{"artifact":"gemini_generator_gate4_connectivity_receipt","authorization":"Johnny separately authorized one Gate 4 metadata request with a maximum total cost of $1.00.","cost":{"actual_usd_millionths":null,"authorized_cap_usd_millionths":1000000,"pre_request_reservation_usd_millionths":1000000,"reconciliation_state":"unknown_pending_billing"},"disposition":"passed","execution_timestamp_utc":"2026-08-14T21:27:29Z","metadata":{"baseModelId":null,"name":"models/gemini-3.7-flash","supportedGenerationMethods":["generateContent","countTokens","createCachedContent","batchGenerateContent"],"validation":{"duplicate_json_keys_absent":true,"forbidden_content_candidate_usage_tool_fields_absent":true,"generate_content_present":true,"name_exact":true,"single_metadata_object":true},"version":"3.7-flash-08-2026"},"prior_receipt_row_hash":null,"proposal_sha256":"b489df11e0d67e1ccfc99cafde0c25a71319436e4b12ab2a488be4276c97bfad","redaction_scan":{"key_like_value_found":false,"raw_error_persisted":false},"response":{"byte_count":435,"http_status":200,"provider_request_id":null,"reported_usage_fields":[],"sha256":"41563d3ae2b3cb03bc388fe9bbffe21a5f32965688005bcffcffec1df353570a"},"row_hash":"43635ccaa2c12a29519b6bab7ba4d539c8e186f00ff1155cfcb7bf0943c05d7f","stop_reason":null,"transport":{"endpoint":"https://generativelanguage.googleapis.com/v1beta/models/gemini-3.7-flash","header_names":["Accept","x-goog-api-key"],"method":"GET","provider_request_count":1,"redirects_disabled":true,"request_body_byte_count":0,"retries_disabled":true,"timeout_seconds":30}}
